<?xml version="1.0" encoding="UTF-8"?>

<!-- MODELUJE ISPLATNICU ANONIMUS UZIMA DJOKI FTN-U -->

<nalog-za-prenos xmlns="http://www.najjacabanka.com/"
        xmlns:xsi="http://www.w3.org/2001/XMLSchema-instance"
        xsi:schemaLocation="http://www.najjacabanka.com/ file:/C:/Users/FS-LB/Desktop/PoslovnaInformatika/Projekat/pinf_pro/XMLSchemas/NalogZaPrenos.xsd">
    <duznik>Djoka DjokiÄ‡</duznik>
    <svrha-placanja>Probno placanje 2</svrha-placanja>
    <poverilac>Anonimus Anonimus</poverilac>
    <datum-prijema>2016-06-26T09:22:25</datum-prijema>
    <mesto-prijema>Novi Sad</mesto-prijema>
    <datum-valute>2016-06-25T06:00:00</datum-valute>
    <racun-duznika>001900000000000101</racun-duznika>
    <model-zaduzenja>97</model-zaduzenja>
    <poziv-na-broj-zaduzenja>2223333</poziv-na-broj-zaduzenja>
    <vrsta-placanja>287</vrsta-placanja>
    <valuta-placanja>RSD</valuta-placanja>
    <iznos>3.00</iznos>
    <hitno>0</hitno>
    <tip-greske>0</tip-greske>
    <status></status>
</nalog-za-prenos>
