<?xml version="1.0" encoding="UTF-8"?>

<!-- MODELUJE UPLATNICU DJOKA UPLACUJE JEVROSIMU FTN-U -->

<nalog-za-prenos xmlns="http://www.najjacabanka.com/"
        xmlns:xsi="http://www.w3.org/2001/XMLSchema-instance"
        xsi:schemaLocation="http://www.najjacabanka.com/ file:/C:/Users/FS-LB/Desktop/PoslovnaInformatika/Projekat/pinf_pro/XMLSchemas/NalogZaPrenos.xsd">
    <duznik>Duznik Djoka</duznik>
    <svrha-placanja>Probno placanje</svrha-placanja>
    <poverilac>Poverilac Jevrosim FTN</poverilac>
    <datum-prijema>2016-06-25T09:22:25</datum-prijema>
    <mesto-prijema>Novi Sad</mesto-prijema>
    <datum-valute>2016-06-25T06:00:00</datum-valute>
    <racun-poverioca>840-0000001710666-12</racun-poverioca>
    <model-odobrenja>97</model-odobrenja>
    <poziv-na-broj-odobrenja>00-00000-0-0000-00000</poziv-na-broj-odobrenja>
    <vrsta-placanja>289</vrsta-placanja>
    <valuta-placanja>RSD</valuta-placanja>
    <iznos>4200.00</iznos>
    <hitno>nije</hitno>
    <tip-greske>0</tip-greske>
    <status></status>
</nalog-za-prenos>
